{
  "apiVersion": "assent.dev/v1alpha1",
  "kind": "ApprovalEvidence",
  "principal": { "id": "5501", "username": "reviewer-x", "isAuthor": false },
  "source": { "rule": "topic-registry-owners", "ruleType": "code_owner" },
  "eligibility": { "eligibleApproverIds": ["5501", "5502", "5503"] },
  "approvalsRequired": 2,
  "approvedBy": [
    { "id": "5501", "username": "reviewer-x", "isAuthor": false },
    { "id": "5503", "username": "reviewer-z", "isAuthor": false }
  ],
  "pins": {
    "toolVersion": "0.1.0",
    "toolDigest": "sha256:00112233445566778899aabbccddeeff00112233445566778899aabbccddeeff",
    "policySha": "sha256:aabb00112233445566778899ccddeeff00112233445566778899aabbccddeeff",
    "sourceSha": "2a7b8c9d0e1f2a3b4c5d6e7f8091a2b3c4d5e6f7",
    "targetSha": "b5c6d7e8f9001122334455667788990011aabbcc",
    "mergeResultDigest": "sha256:8e7d6c5b4a39281706f5e4d3c2b1a09f8e7d6c5b4a39281706f5e4d3c2b1a09f",
    "factsResolvedAt": { "owner": "2026-07-24T09:00:00Z" }
  },
  "observedAt": "2026-07-24T09:00:30Z",
  "verifyingCapability": "codeowners"
}
